{
  "$schema": "https://json-schema.org/draft/2020-12/schema",
  "$id": "https://basis-core/schemas/policy.schema.json",
  "title": "Policy",
  "description": "A serializable policy definition. Describes a set of policy rules that can be persisted, distributed, or loaded from configuration. Each rule type corresponds to a concrete PolicyRule implementation in basis_core.policy.rules.",
  "type": "object",
  "required": ["policy_id", "policy_type", "version", "created_at"],
  "additionalProperties": false,
  "properties": {
    "policy_id": {
      "type": "string",
      "minLength": 1,
      "description": "Stable identifier for this policy definition. Treat as an external identifier — do not rename after the policy is deployed."
    },
    "policy_type": {
      "type": "string",
      "enum": ["role_policy", "resource_type_policy", "action_policy", "composite_policy"],
      "description": "The kind of policy this definition describes. Determines the expected structure of the rules array. 'role_policy' maps actions to permitted roles. 'resource_type_policy' constrains permitted resource types. 'action_policy' assigns explicit outcomes to named actions. 'composite_policy' combines multiple rule sets."
    },
    "version": {
      "type": "string",
      "minLength": 1,
      "description": "Version identifier. Appears in DecisionResponse.policy_version and AuditEvent.policy_version for correlation. Non-empty."
    },
    "description": {
      "type": ["string", "null"],
      "description": "Human-readable description of this policy's purpose and the operational context it governs. Informational only."
    },
    "created_at": {
      "type": "string",
      "format": "date-time",
      "description": "ISO 8601 UTC timestamp of when this policy version was created or last modified. Must include timezone offset."
    },
    "created_by": {
      "type": ["string", "null"],
      "description": "Identifier of the principal that created or last modified this policy. Used for policy change audit records."
    },
    "evaluation_semantics": {
      "type": "string",
      "enum": ["deny_overrides"],
      "default": "deny_overrides",
      "description": "The aggregation semantics applied when multiple rules are present. Only 'deny_overrides' is supported: a DENY from any rule overrides any ALLOW; if all rules return NOT_APPLICABLE the default is DENY."
    },
    "rules": {
      "type": "array",
      "description": "Ordered list of policy rules. Structure depends on policy_type.",
      "items": {
        "type": "object",
        "required": ["rule_type"],
        "additionalProperties": false,
        "properties": {
          "rule_type": {
            "type": "string",
            "enum": ["role", "resource_type", "action"],
            "description": "The type of this rule. Determines which fields are relevant. 'role': action-to-roles mapping. 'resource_type': permitted resource type set. 'action': explicit action-to-outcome mapping."
          },
          "action": {
            "type": "string",
            "minLength": 1,
            "pattern": "^[a-z][a-z0-9_-]*(:[a-z][a-z0-9_-]*)+$",
            "description": "For 'role' rules: the action name this rule governs. Must follow the '{verb}:{domain}[:{object}]' naming convention."
          },
          "permitted_roles": {
            "type": "array",
            "items": {
              "type": "string",
              "minLength": 1
            },
            "uniqueItems": true,
            "description": "For 'role' rules: role names permitted to perform this action. Non-empty items only."
          },
          "permitted_resource_types": {
            "type": "array",
            "items": {
              "type": "string",
              "enum": ["hvac", "sensor", "zone", "device", "gateway"]
            },
            "uniqueItems": true,
            "description": "For 'resource_type' rules: resource type values that are permitted targets. Must match ResourceType enum values."
          },
          "action_outcomes": {
            "type": "object",
            "additionalProperties": {
              "type": "string",
              "enum": ["allow", "deny", "not_applicable"]
            },
            "description": "For 'action' rules: map of action name to explicit outcome. Each key is an action name; each value is a PolicyOutcome string."
          }
        }
      }
    }
  }
}
